{"adjudicated_classification":"compatible_additive_top_level_extension","all_rules_strictly_valid":true,"baseline_alias":"l2m-firewall-baseline-b0ef71115811","canonical_semantic_sha256":"b0ef711158113cdbdbb1707cb43f21a635271bb2e93bfc0e898ce7118589f764","capture_plan_id":"PLAN-T07-GATE-L2M-FIREWALL-BASELINE-CAPTURE-V1","capture_run_id":"RUN-T07-L2M-FIREWALL-BASELINE-CAPTURE-0001","cloud_mutation_occurred":false,"compatible_top_level_extensions":[{"name":"workspace_id","type":"string"}],"external_request_during_adjudication":false,"immutable_evidence":{"external_copy_record_sha256":"4256db4e1657e29e59b3ff642039157f6866590403ee02b7b4a4a6fa69cfe268","external_manifest_sha256":"2b2c9deb74f45e2da45bc6209aa3a45e10f290a9aff6ac955da543d89df4823d","external_seal_sha256":"2ac3a92a4f6e4cd2963b8f816925c0a7111d4f2f469a3104d1d94e4522723897","raw_response_sha256":"983d231beefd2e446c4b9261be5da812862a7e629535cb063c6413cd67f55adf","request_ledger_sha256":"f37e4e450ff5d7ab203dcbdfcd00318bf3ee5b053469207517b19e26c549fb43"},"official_contract":{"additional_properties_explicitly_forbidden":false,"api_version":"1.10.0","bytes":240288,"openapi_version":"3.1.0","sha256":"320f4877924984f060b179e86595ed58918a1d0696b60b99cae548ec164934f4","url":"https://docs-api.lambda.ai/api/cloud/spec.json"},"original_disposition":"schema_drift","private_scalar_values_retained":false,"request":{"elapsed_ms":291,"http_status":200,"method":"GET","path":"/api/v1/firewall-rulesets/global","response_bytes":660},"response_parser_version":"t07-firewall-response-v2","restoration_payload_alias":"l2m-firewall-restoration-50ca7febe9f1","restoration_payload_sha256":"50ca7febe9f160ada862371376485ea2ece11b373d25179ccd578d9c7acd42b8","rule_count":4,"run_replay_allowed":false,"schema_version":"0.1.0"}
